{
  "name": "Paramount+",
  "author": {
    "name": "KiMi",
    "github": "q-kimi"
  },
  "url": ["paramountplus.com", "www.paramountplus.com"],
  "regExp": "^https?://(www\\.)?paramountplus\\.com/",
  "color": "#0064FF",
  "category": "streaming",
  "description": {
    "en-US": "Watch movies, series, live sports, and exclusive originals on Paramount+.",
    "fr-FR": "Regardez films, séries, sport en direct et exclusivités originales sur Paramount+.",
    "es-ES": "Disfruta de películas, series, deportes en directo y originales exclusivos en Paramount+."
  },
  "longDescription": {
    "en-US": "Paramount+ streams a huge catalog of movies, series, live sports, and exclusive originals from CBS, MTV, Nickelodeon, Comedy Central, and more. Automatically display the movie or episode you're watching, including season and episode information and playback status, and let your friends see what you're streaming in real time.",
    "fr-FR": "Paramount+ propose un vaste catalogue de films, séries, sport en direct et exclusivités originales de CBS, MTV, Nickelodeon, Comedy Central et plus encore. Affichez automatiquement le film ou l'épisode que vous regardez, avec les informations de saison et d'épisode ainsi que le statut de lecture, et permettez à vos amis de voir ce que vous regardez en temps réel.",
    "es-ES": "Paramount+ ofrece un amplio catálogo de películas, series, deportes en directo y originales exclusivos de CBS, MTV, Nickelodeon, Comedy Central y mucho más. Muestra automáticamente la película o el episodio que estás viendo, incluyendo la temporada, el episodio y el estado de reproducción, y permite que tus amigos vean lo que estás disfrutando en tiempo real."
  },
  "features": {
    "en-US": [
      "Automatic content detection",
      "Display movie and series titles",
      "Season and episode information",
      "Playback status tracking",
      "Real-time viewing activity"
    ],
    "fr-FR": [
      "Détection automatique du contenu",
      "Affichage des titres des films et séries",
      "Informations sur les saisons et épisodes",
      "Suivi du statut de lecture",
      "Activité de visionnage en temps réel"
    ],
    "es-ES": [
      "Detección automática del contenido",
      "Visualización de títulos de películas y series",
      "Información de temporadas y episodios",
      "Seguimiento del estado de reproducción",
      "Actividad de visualización en tiempo real"
    ]
  },
  "assets": {
    "logo": "logo.png",
    "icon": "icon.png",
    "thumbnail": "thumbnail.jpg"
  }
}
