{
  "name": "Cinepulse",
  "author": {
    "name": "KiMi",
    "github": "q-kimi"
  },
  "url": ["cinepulse.ws", "www.cinepulse.ws"],
  "regExp": "^https?://(?:www\\.)?cinepulse\\.ws",
  "color": "#090201",
  "category": "streaming",
  "description": {
    "en-US": "Watch movies and series on Cinepulse.",
    "fr-FR": "Regardez des films et séries sur Cinepulse.",
    "es-ES": "Disfruta de películas y series en Cinepulse."
  },
  "longDescription": {
    "en-US": "Cinepulse is a private streaming platform for movies and series. Automatically display what you're watching, including the title, season and episode information, and playback status.",
    "fr-FR": "Cinepulse est une plateforme de streaming privée pour les films et séries. Affichez automatiquement ce que vous regardez, avec le titre, les informations de saison et d'épisode, ainsi que votre statut de lecture.",
    "es-ES": "Cinepulse es una plataforma de streaming privada para películas y series. Muestra automáticamente lo que estás viendo, incluyendo el título, la temporada, el episodio y el estado de reproducción."
  },
  "features": {
    "en-US": [
      "Automatic content detection",
      "Movie and series support",
      "Season and episode tracking",
      "Playback status (playing / paused)",
      "Real-time viewing activity"
    ],
    "fr-FR": [
      "Détection automatique du contenu",
      "Support des films et séries",
      "Suivi de la saison et de l'épisode",
      "Statut de lecture (en cours / pause)",
      "Activité de visionnage en temps réel"
    ],
    "es-ES": [
      "Detección automática del contenido",
      "Compatible con películas y series",
      "Seguimiento de temporada y episodio",
      "Estado de reproducción (en curso / pausado)",
      "Actividad de visualización en tiempo real"
    ]
  },
  "assets": {
    "logo": "logo.png",
    "icon": "icon.png",
    "thumbnail": "thumbnail.jpg"
  }
}
