{
  "name": "YouTube Music",
  "author": {
    "name": "Gaëtan H",
    "github": "steellgold"
  },
  "url": ["music.youtube.com"],
  "regExp": "^https?://music\\.youtube\\.com/",
  "color": "#FF0000",
  "category": "music",
  "description": {
    "en-US": "Listen to songs, albums, playlists, and music videos on YouTube Music.",
    "fr-FR": "Écoutez des titres, albums, playlists et clips sur YouTube Music.",
    "es-ES": "Escucha canciones, álbumes, playlists y videoclips en YouTube Music."
  },
  "longDescription": {
    "en-US": "YouTube Music is Google's music streaming service. Automatically display the track you are listening to, including title, artist, playback state, listening time, and cover artwork when available.",
    "fr-FR": "YouTube Music est le service de streaming musical de Google. Affichez automatiquement le titre que vous écoutez, avec le nom du morceau, l'artiste, l'état de lecture, le temps d'écoute et la pochette quand elle est disponible.",
    "es-ES": "YouTube Music es el servicio de streaming musical de Google. Muestra automáticamente la canción que estás escuchando, incluyendo título, artista, estado de reproducción, tiempo de escucha y portada cuando esté disponible."
  },
  "features": {
    "en-US": [
      "Automatic track detection",
      "Display title and artist",
      "Real-time listening progress",
      "Album artwork support",
      "Browsing activity support"
    ],
    "fr-FR": [
      "Détection automatique des titres",
      "Affichage du titre et de l'artiste",
      "Progression d'écoute en temps réel",
      "Support des pochettes d'album",
      "Support de l'activité de navigation"
    ],
    "es-ES": [
      "Detección automática de canciones",
      "Visualización del título y artista",
      "Progreso de escucha en tiempo real",
      "Soporte para portadas de álbum",
      "Soporte de actividad de navegación"
    ]
  },
  "assets": {
    "logo": "logo.png",
    "icon": "icon.png",
    "thumbnail": "thumbnail.jpg"
  }
}
