{
  "name": "CANAL+",
  "author": {
    "name": "KiMi",
    "github": "q-kimi"
  },
  "url": ["canalplus.com", "www.canalplus.com"],
  "regExp": "^https?://(www\\.)?canalplus\\.com/",
  "color": "#ffffff",
  "category": "streaming",
  "description": {
    "en-US": "Watch movies, series, live TV, sports, and replays on CANAL+.",
    "fr-FR": "Regardez films, séries, TV en direct, sport et replays sur CANAL+.",
    "es-ES": "Disfruta de películas, series, televisión en directo, deporte y repeticiones en CANAL+."
  },
  "longDescription": {
    "en-US": "CANAL+ brings together movies, series, live channels, sports competitions, documentaries, and replay programs in one streaming platform. Automatically display what you're watching, including the title, playback status, and progress when available, while keeping browsing activity optional.",
    "fr-FR": "CANAL+ réunit films, séries, chaînes en direct, compétitions sportives, documentaires et programmes en replay dans une seule plateforme de streaming. Affichez automatiquement ce que vous regardez, avec le titre, le statut de lecture et la progression lorsque disponible, tout en gardant l'activité de navigation optionnelle.",
    "es-ES": "CANAL+ reúne películas, series, canales en directo, competiciones deportivas, documentales y programas en replay en una sola plataforma de streaming. Muestra automáticamente lo que estás viendo, incluido el título, el estado de reproducción y el progreso cuando esté disponible, manteniendo la actividad de navegación como opcional."
  },
  "features": {
    "en-US": [
      "Automatic video detection",
      "Movie, series, live TV, and replay support",
      "Playback status tracking",
      "Progress bar when media duration is available",
      "Optional browsing activity"
    ],
    "fr-FR": [
      "Détection automatique des vidéos",
      "Prise en charge des films, séries, directs TV et replays",
      "Suivi du statut de lecture",
      "Barre de progression lorsque la durée du média est disponible",
      "Activité de navigation optionnelle"
    ],
    "es-ES": [
      "Detección automática de vídeo",
      "Compatibilidad con películas, series, televisión en directo y repeticiones",
      "Seguimiento del estado de reproducción",
      "Barra de progreso cuando la duración del contenido está disponible",
      "Actividad de navegación opcional"
    ]
  },
  "assets": {
    "logo": "logo.png",
    "icon": "icon.png",
    "thumbnail": "thumbnail.jpg"
  }
}
